{
  "kind": "cards",
  "subjectCode": "POL",
  "topic": "Statutory, Regulatory & Quasi-Judicial Bodies",
  "items": [
    {
      "id": "pol-statutory-regulatory-bodies-card-1",
      "subjectCode": "POL",
      "subtopicId": "pol-statutory-regulatory-bodies",
      "front": "Statutory vs constitutional vs executive — the test?",
      "back": "Statutory = created by an Act (NHRC, CVC, SEBI, NGT, Lokpal, CIC); Constitutional = named in the Constitution (ECI, CAG, UPSC); Executive = by resolution (NITI Aayog, Law Commission).",
      "examPoint": "Constitutional vs statutory vs executive — classification",
      "source": "APPSC GK — Non-Constitutional Bodies",
      "verified": true
    },
    {
      "id": "pol-statutory-regulatory-bodies-card-2",
      "subjectCode": "POL",
      "subtopicId": "pol-statutory-regulatory-bodies",
      "front": "NHRC — statute, 2019 change, and armed-forces limit?",
      "back": "Protection of Human Rights Act 1993; 2019 amendment lets a former SC judge (not only ex-CJI) chair and cut term 5→3 yrs; recommendatory; cannot directly investigate the armed forces.",
      "examPoint": "NHRC — statutory body, composition & powers",
      "source": "APPSC GK; PHR (Amendment) Act 2019",
      "verified": true
    },
    {
      "id": "pol-statutory-regulatory-bodies-card-3",
      "subjectCode": "POL",
      "subtopicId": "pol-statutory-regulatory-bodies",
      "front": "CBI — legal basis and the State-consent rule?",
      "back": "Delhi Special Police Establishment (DSPE) Act 1946 (SPE 1941 → CBI 1963 resolution); under Ministry of Personnel; needs a State's general consent (Sec 6 DSPE) to operate there.",
      "examPoint": "CBI — DSPE Act 1946, State consent",
      "source": "APPSC GK — Non-Constitutional Bodies",
      "verified": true
    },
    {
      "id": "pol-statutory-regulatory-bodies-card-4",
      "subjectCode": "POL",
      "subtopicId": "pol-statutory-regulatory-bodies",
      "front": "CVC — origin, statute, power over CBI?",
      "back": "Set up 1964 (Santhanam Committee); statutory since CVC Act 2003; Central Vigilance Commissioner + 2 VCs; can direct and supervise the CBI in corruption cases; advisory.",
      "examPoint": "CVC — Santhanam Committee, CVC Act 2003",
      "source": "APPSC GK — Non-Constitutional Bodies",
      "verified": true
    },
    {
      "id": "pol-statutory-regulatory-bodies-card-5",
      "subjectCode": "POL",
      "subtopicId": "pol-statutory-regulatory-bodies",
      "front": "Lokpal — statute, composition, jurisdiction over PM?",
      "back": "Lokpal & Lokayuktas Act 2013; Chairperson + up to 8 members (≥half judicial); covers the PM with safeguards (excludes intl relations, security, atomic energy, space). 1st Chair: Justice P.C. Ghose.",
      "examPoint": "Lokpal & Lokayuktas Act 2013 — composition & jurisdiction",
      "source": "APPSC GK — Non-Constitutional Bodies",
      "verified": true
    },
    {
      "id": "pol-statutory-regulatory-bodies-card-6",
      "subjectCode": "POL",
      "subtopicId": "pol-statutory-regulatory-bodies",
      "front": "CIC — statute, size, and the 2019 change?",
      "back": "RTI Act 2005; Chief Information Commissioner + up to 10 ICs; appointed by President on a committee (PM, LoP, a Union Minister). RTI (Amendment) 2019 let the Centre fix tenure/salaries.",
      "examPoint": "CIC — RTI Act 2005 & 2019 amendment",
      "source": "APPSC GK; RTI Act 2005/2019",
      "verified": true
    },
    {
      "id": "pol-statutory-regulatory-bodies-card-7",
      "subjectCode": "POL",
      "subtopicId": "pol-statutory-regulatory-bodies",
      "front": "Regulator statute-years: RBI, SEBI, TRAI, IRDAI, CCI, PFRDA?",
      "back": "RBI 1934, SEBI Act 1992 (body 1988), TRAI 1997, IRDAI 1999, CCI (Competition Act 2002, operational 2009), PFRDA 2013. All statutory; combine rule-making + supervision + quasi-judicial penalties.",
      "examPoint": "Sectoral regulators & their statutes",
      "source": "APPSC GK; relevant regulator Acts",
      "verified": true
    },
    {
      "id": "pol-statutory-regulatory-bodies-card-8",
      "subjectCode": "POL",
      "subtopicId": "pol-statutory-regulatory-bodies",
      "front": "NGT — statute, bench, appeals?",
      "back": "NGT Act 2010; quasi-judicial; judicial + expert (scientific) members; orders binding, can award compensation; appeals lie to the Supreme Court.",
      "examPoint": "NGT — NGT Act 2010, quasi-judicial",
      "source": "APPSC GK; NGT Act 2010",
      "verified": true
    },
    {
      "id": "pol-statutory-regulatory-bodies-card-9",
      "subjectCode": "POL",
      "subtopicId": "pol-statutory-regulatory-bodies",
      "front": "Tribunals in the Constitution — which amendment, which articles?",
      "back": "42nd Amendment 1976 added Art 323A (administrative tribunals, e.g. CAT for service matters) and Art 323B (taxation, environment, etc.).",
      "examPoint": "Article 323A/323B tribunals (42nd Amendment)",
      "source": "Constitution Arts 323A/323B",
      "verified": true
    },
    {
      "id": "pol-statutory-regulatory-bodies-card-10",
      "subjectCode": "POL",
      "subtopicId": "pol-statutory-regulatory-bodies",
      "front": "99th Amendment / NJAC — what happened?",
      "back": "The 99th Amendment (2014) set up the NJAC; the Supreme Court struck it down (2015) as violating judicial independence, restoring the collegium system.",
      "examPoint": "99th Amendment / NJAC struck down; collegium restored",
      "source": "UPSC 2019 PYQ; SC NJAC judgment 2015",
      "verified": true
    },
    {
      "id": "pol-statutory-regulatory-bodies-card-11",
      "subjectCode": "POL",
      "subtopicId": "pol-statutory-regulatory-bodies",
      "front": "NALSA & Gram Nyayalayas — statutes and key facts?",
      "back": "NALSA — Legal Services Authorities Act 1987 (patron CJI; Lok Adalats; free legal aid). Gram Nyayalayas — Act 2008; try BOTH civil and criminal cases; allow social activists as mediators.",
      "examPoint": "NALSA & Legal Services Authorities Act 1987 (Lok Adalats)",
      "source": "UPSC 2013/2016 PYQ",
      "verified": true
    },
    {
      "id": "pol-statutory-regulatory-bodies-card-12",
      "subjectCode": "POL",
      "subtopicId": "pol-statutory-regulatory-bodies",
      "front": "Tea Board & Forest Rights Act — the exam traps?",
      "back": "Tea Board: statutory, under Ministry of Commerce (NOT Agriculture), HQ Kolkata (NOT Bengaluru). FRA 2006 nodal ministry = Ministry of Tribal Affairs (Gram Sabha initiates claims).",
      "examPoint": "Commodity Boards — Tea Board (Ministry of Commerce, HQ Kolkata)",
      "source": "UPSC 2019/2021 PYQ",
      "verified": true
    },
    {
      "id": "pol-statutory-regulatory-bodies-card-13",
      "subjectCode": "POL",
      "subtopicId": "pol-statutory-regulatory-bodies",
      "front": "NDMA, Law Commission, UGC — nature and heads?",
      "back": "NDMA — Disaster Management Act 2005, PM is ex-officio Chairperson (State: CM). Law Commission — non-statutory (1955 resolution), advice not binding. UGC — UGC Act 1956, regulates higher education.",
      "examPoint": "NDMA, Law Commission, UGC — basis & headship",
      "source": "APPSC GK; DM Act 2005; UGC Act 1956",
      "verified": true
    },
    {
      "id": "pol-statutory-regulatory-bodies-card-14",
      "subjectCode": "POL",
      "subtopicId": "pol-statutory-regulatory-bodies",
      "front": "Under which Act does the Bureau of Indian Standards now work?",
      "back": "The BIS Act, 2016 (replacing the 1986 Act; the ISI dated from 1947).",
      "examPoint": "CBI, CVC, Lokpal and Lokayuktas in full — Acts, years, selection committees, terms, jurisdiction, first and current heads, AP Lokayukta",
      "source": "APPSC GK — Indian Polity: Non-Constitutional bodies (.txt, read in full); M. Laxmikanth, Indian Polity (Ch. 51-62: NITI Aayog, NHRC, SHRC, CIC, SIC, CVC, CBI, Lokpal and Lokayuktas, NCW, NCM, tribunals) standard treatment; PYQ bank .research/pyq-bank/pol-statutory-regulatory-bodies.md; office-holders verified on the web (PIB, The Hindu, LiveLaw, ET), 18 Oct 2026",
      "verified": true
    },
    {
      "id": "pol-statutory-regulatory-bodies-card-15",
      "subjectCode": "POL",
      "subtopicId": "pol-statutory-regulatory-bodies",
      "front": "How many cases did the AP State Information Commission dispose of in January-September 2026?",
      "back": "7,034 cases — earning national recognition at the RTI Act Foundation Day (October 2026).",
      "examPoint": "CBI, CVC, Lokpal and Lokayuktas in full — Acts, years, selection committees, terms, jurisdiction, first and current heads, AP Lokayukta",
      "source": "APPSC GK — Indian Polity: Non-Constitutional bodies (.txt, read in full); M. Laxmikanth, Indian Polity (Ch. 51-62: NITI Aayog, NHRC, SHRC, CIC, SIC, CVC, CBI, Lokpal and Lokayuktas, NCW, NCM, tribunals) standard treatment; PYQ bank .research/pyq-bank/pol-statutory-regulatory-bodies.md; office-holders verified on the web (PIB, The Hindu, LiveLaw, ET), 18 Oct 2026",
      "verified": true
    }
  ]
}
