{
  "kind": "cards",
  "subjectCode": "MENT",
  "topic": "Relationships (Blood Relations)",
  "items": [
    {
      "id": "ment-relationships-card-1",
      "subjectCode": "MENT",
      "subtopicId": "ment-relationships",
      "front": "Best first step for any blood-relation puzzle?",
      "back": "Draw a top-down family tree: elders on top, children below, same generation on one row; fix gender the instant a gendered word appears.",
      "examPoint": "Blood relations — family-tree / multi-person puzzle",
      "source": "APPSC Group-1 — Blood Relations (Family Based)",
      "verified": true
    },
    {
      "id": "ment-relationships-card-2",
      "subjectCode": "MENT",
      "subtopicId": "ment-relationships",
      "front": "Family-chart notation: □, ○, = , | ?",
      "back": "□ = male, ○ = female; horizontal '=' = married couple; vertical '|' = parent→child (descent).",
      "examPoint": "Blood relations — symbol/family-chart representation",
      "source": "APPSC Group-1 — Blood Relations (Family Chart)",
      "verified": true
    },
    {
      "id": "ment-relationships-card-3",
      "subjectCode": "MENT",
      "subtopicId": "ment-relationships",
      "front": "'The only daughter of my mother' (said by a woman) resolves to?",
      "back": "The female speaker herself. 'Only son of my father' (said by a man) = himself. Collapse self-reference first.",
      "examPoint": "Blood relations — photo/self-reference statements",
      "source": "APPSC Group-1 — Blood Relations (Photo/Self-reference)",
      "verified": true
    },
    {
      "id": "ment-relationships-card-4",
      "subjectCode": "MENT",
      "subtopicId": "ment-relationships",
      "front": "In coded relations, how do you tell maternal from paternal?",
      "back": "Route through the father = paternal relative; through the mother = maternal. Two people who are both parents of one child are spouses.",
      "examPoint": "Blood relations — maternal vs paternal side",
      "source": "APPSC Group-1 — Blood Relations (Coded)",
      "verified": true
    },
    {
      "id": "ment-relationships-card-5",
      "subjectCode": "MENT",
      "subtopicId": "ment-relationships",
      "front": "Why does 'only son/daughter' matter in a puzzle?",
      "back": "It blocks any cousin/aunt/uncle branch on that side, usually forcing the chain to the speaker's own parent or the speaker.",
      "examPoint": "Blood relations — 'only son/daughter' trap phrasing",
      "source": "APPSC Group-1 — Blood Relations (Traps)",
      "verified": true
    },
    {
      "id": "ment-relationships-card-6",
      "subjectCode": "MENT",
      "subtopicId": "ment-relationships",
      "front": "Descent links up vs relation?",
      "back": "1 link = parent, 2 = grandparent, 3 = great-grandparent. Spouse's parent = parent-in-law; daughter's husband = son-in-law.",
      "examPoint": "Blood relations — generation identification & counting",
      "source": "APPSC Group-1 — Blood Relations (Generations)",
      "verified": true
    },
    {
      "id": "ment-relationships-card-7",
      "subjectCode": "MENT",
      "subtopicId": "ment-relationships",
      "front": "The decisive check in a data-sufficiency blood-relation item?",
      "back": "Is the target person's GENDER fixed? 'Child/parent/cousin/spouse' are gender-neutral; a statement can fix the tree yet stay insufficient.",
      "examPoint": "Blood relations — data sufficiency",
      "source": "APPSC Group-1 — Data Sufficiency in Blood Relation",
      "verified": true
    },
    {
      "id": "ment-relationships-card-8",
      "subjectCode": "MENT",
      "subtopicId": "ment-relationships",
      "front": "Linear seating: where to start, and the facing rule?",
      "back": "Fix the most-constrained seat (often the middle) first. Facing north → person's left = observer's left; facing south flips left/right.",
      "examPoint": "Seating — linear arrangement (facing same direction)",
      "source": "APPSC Group-1 — Seating Arrangement & Ranking",
      "verified": true
    },
    {
      "id": "ment-relationships-card-9",
      "subjectCode": "MENT",
      "subtopicId": "ment-relationships",
      "front": "Circular seating (facing centre): left-right & opposite equivalence for n seats?",
      "back": "'k to the left' = '(n−k) to the right'; the exactly-opposite seat is n/2 places away (only when n is even).",
      "examPoint": "Seating — circular arrangement: opposite and left-right equivalence",
      "source": "APPSC Group-1 — Seating Arrangement & Ranking",
      "verified": true
    },
    {
      "id": "ment-relationships-card-10",
      "subjectCode": "MENT",
      "subtopicId": "ment-relationships",
      "front": "Ranking: total people when one person's positions from both ends are given?",
      "back": "Total = L + R − 1 (the person is counted from both ends). Position from other end = N − (this-end position) + 1.",
      "examPoint": "Ranking — total persons from positions from both ends",
      "source": "APPSC Group-1 — Seating Arrangement & Ranking",
      "verified": true
    },
    {
      "id": "ment-relationships-card-11",
      "subjectCode": "MENT",
      "subtopicId": "ment-relationships",
      "front": "Ranking on interchange of two persons' seats?",
      "back": "Each person takes the other's fixed position; then total = (new position from left) + (that seat's position from right) − 1.",
      "examPoint": "Ranking — interchange of positions",
      "source": "APPSC Group-1 — Seating Arrangement & Ranking",
      "verified": true
    },
    {
      "id": "ment-relationships-card-12",
      "subjectCode": "MENT",
      "subtopicId": "ment-relationships",
      "front": "What are the three types of blood-relation questions?",
      "back": "Pointing/introduction based; family based (relations by blood or by law/marriage); coded (symbols like +, $, # stand for relations).",
      "examPoint": "Blood relations — symbol/family-chart representation",
      "source": "APPSC Logical Reasoning extracted text (Family Based Blood Relation, Coded Blood Relation Problems, Pointing/Introduction Based, Data Sufficiency in Blood Relation, Linear/Circular Seating Arrangement, Ranking, Order Based); standard reasoning references; PYQ bank .research/pyq-bank/ment-relationships.md",
      "verified": true
    }
  ]
}
