{
  "kind": "cards",
  "subjectCode": "POL",
  "topic": "Fundamental Rights",
  "items": [
    {
      "id": "pol-fundamental-rights-card-1",
      "subjectCode": "POL",
      "subtopicId": "pol-fundamental-rights",
      "front": "Part III range and how many Fundamental Rights now?",
      "back": "Articles 12-35; six FRs now (originally seven). Right to Property was the dropped seventh.",
      "examPoint": "Part III & scope — Articles 12-35, borrowed from US Bill of Rights / UDHR",
      "source": "Constitution of India, Part III",
      "verified": true
    },
    {
      "id": "pol-fundamental-rights-card-2",
      "subjectCode": "POL",
      "subtopicId": "pol-fundamental-rights",
      "front": "Under which Fundamental Right does abolition of untouchability (Art 17) fall?",
      "back": "Right to Equality (Articles 14-18).",
      "examPoint": "Article 17 — abolition of untouchability",
      "source": "UPSC 2020 PYQ; Art 17",
      "verified": true
    },
    {
      "id": "pol-fundamental-rights-card-3",
      "subjectCode": "POL",
      "subtopicId": "pol-fundamental-rights",
      "front": "Present status of the Right to Property?",
      "back": "A legal/constitutional right under Article 300A (available to any person); ceased to be a FR by the 44th Amendment 1978.",
      "examPoint": "Six Fundamental Rights now (originally 7); Right to Property removed by 44th Amendment 1978 → Article 300A legal right",
      "source": "UPSC 2021 PYQ; 44th Amendment 1978",
      "verified": true
    },
    {
      "id": "pol-fundamental-rights-card-4",
      "subjectCode": "POL",
      "subtopicId": "pol-fundamental-rights",
      "front": "Right to Privacy — which Article and which case?",
      "back": "Article 21 (life & personal liberty); K.S. Puttaswamy v. Union of India (2017), 9-judge bench.",
      "examPoint": "Article 21 — life & personal liberty; Maneka Gandhi expansion",
      "source": "UPSC 2018/2021 PYQ; Puttaswamy 2017",
      "verified": true
    },
    {
      "id": "pol-fundamental-rights-card-5",
      "subjectCode": "POL",
      "subtopicId": "pol-fundamental-rights",
      "front": "Right to marry a person of one's choice is protected under which Article?",
      "back": "Article 21 (part of the right to life and personal liberty).",
      "examPoint": "Article 21 — life & personal liberty; Maneka Gandhi expansion",
      "source": "UPSC 2019 PYQ; Art 21",
      "verified": true
    },
    {
      "id": "pol-fundamental-rights-card-6",
      "subjectCode": "POL",
      "subtopicId": "pol-fundamental-rights",
      "front": "What exactly does the Right against Exploitation (Art 23-24) cover?",
      "back": "Art 23: traffic in humans, begar & forced labour; Art 24: no child below 14 in factory/mine/hazardous work.",
      "examPoint": "Articles 23-24 — right against exploitation (trafficking, forced labour, child labour)",
      "source": "UPSC 2017 PYQ; Arts 23-24",
      "verified": true
    },
    {
      "id": "pol-fundamental-rights-card-7",
      "subjectCode": "POL",
      "subtopicId": "pol-fundamental-rights",
      "front": "Why did Ambedkar call Article 32 the 'heart and soul' of the Constitution?",
      "back": "It lets a person move the Supreme Court directly to enforce Fundamental Rights via five writs.",
      "examPoint": "Article 32 — right to constitutional remedies ('heart and soul', Ambedkar)",
      "source": "Art 32; Constituent Assembly Debates",
      "verified": true
    },
    {
      "id": "pol-fundamental-rights-card-8",
      "subjectCode": "POL",
      "subtopicId": "pol-fundamental-rights",
      "front": "The five writs?",
      "back": "Habeas Corpus, Mandamus, Prohibition, Certiorari, Quo Warranto.",
      "examPoint": "Writs — Habeas Corpus, Mandamus, Prohibition, Certiorari, Quo Warranto",
      "source": "Arts 32 & 226",
      "verified": true
    },
    {
      "id": "pol-fundamental-rights-card-9",
      "subjectCode": "POL",
      "subtopicId": "pol-fundamental-rights",
      "front": "Whose writ jurisdiction is wider — SC (Art 32) or HC (Art 226)?",
      "back": "High Court (Art 226) — it covers FRs AND any other legal right; Art 32 is only for FRs.",
      "examPoint": "Writs — Habeas Corpus, Mandamus, Prohibition, Certiorari, Quo Warranto",
      "source": "Arts 32, 226",
      "verified": true
    },
    {
      "id": "pol-fundamental-rights-card-10",
      "subjectCode": "POL",
      "subtopicId": "pol-fundamental-rights",
      "front": "Which FRs can NEVER be suspended, even during a National Emergency?",
      "back": "Articles 20 and 21 (made non-suspendable by the 44th Amendment 1978). Art 358 auto-suspends Art 19.",
      "examPoint": "Emergency suspension (Art 358/359; 44th Amdt shields Arts 20 & 21); citizens vs all persons",
      "source": "44th Amendment 1978; Arts 358/359",
      "verified": true
    },
    {
      "id": "pol-fundamental-rights-card-11",
      "subjectCode": "POL",
      "subtopicId": "pol-fundamental-rights",
      "front": "Is the right to vote and to be elected a Fundamental Right?",
      "back": "No — it is a constitutional/legal right (not a FR), conferred by the Constitution and RPA laws.",
      "examPoint": "Right to vote and be elected — a constitutional/legal right, not a Fundamental Right",
      "source": "UPSC 2017 PYQ; RPA 1951",
      "verified": true
    },
    {
      "id": "pol-fundamental-rights-card-12",
      "subjectCode": "POL",
      "subtopicId": "pol-fundamental-rights",
      "front": "Article 14 combines which two ideas, and from where?",
      "back": "Equality before law (British) + equal protection of laws (American). Rule of law bars arbitrary/unguided discretion.",
      "examPoint": "Article 14 — equality before law & equal protection of laws; Rule of Law (Dicey) features",
      "source": "UPSC 2018/2021 PYQ; Art 14",
      "verified": true
    },
    {
      "id": "pol-fundamental-rights-card-13",
      "subjectCode": "POL",
      "subtopicId": "pol-fundamental-rights",
      "front": "Besides FRs, which parts of the Constitution reflect the UDHR 1948?",
      "back": "Preamble, DPSP and Fundamental Duties.",
      "examPoint": "Part III & scope — Articles 12-35, borrowed from US Bill of Rights / UDHR",
      "source": "UPSC 2020 PYQ; UDHR 1948",
      "verified": true
    },
    {
      "id": "pol-fundamental-rights-card-14",
      "subjectCode": "POL",
      "subtopicId": "pol-fundamental-rights",
      "front": "Which FRs are for citizens only vs all persons?",
      "back": "Citizens only: Arts 15, 16, 19, 29, 30. All persons (incl. foreigners): Arts 14, 20, 21, 21A, 22, 25-28.",
      "examPoint": "Article 19 — six freedoms and reasonable restrictions",
      "source": "Constitution of India, Part III",
      "verified": true
    },
    {
      "id": "pol-fundamental-rights-card-15",
      "subjectCode": "POL",
      "subtopicId": "pol-fundamental-rights",
      "front": "Which two documents inspired India's Fundamental Rights?",
      "back": "The US Bill of Rights and the Universal Declaration of Human Rights (UDHR, 1948).",
      "examPoint": "Articles 12-22 clause by clause — 13(1)-(3), 15(3)-(6), 16(3)-(6), 17, 18, 19 restrictions, 20, 21 expansion, 21A, 22 preventive detention",
      "source": "APPSC GK — Indian Polity: Fundamental Rights - I (Article 12-22).txt, Fundamental Rights - II (Article 23-35).txt, Important Constitutional Cases.txt; M. Laxmikanth, Indian Polity (Ch. 7) standard treatment; PYQ bank .research/pyq-bank/pol-fundamental-rights.md",
      "verified": true
    },
    {
      "id": "pol-fundamental-rights-card-16",
      "subjectCode": "POL",
      "subtopicId": "pol-fundamental-rights",
      "front": "Besides general discrimination, what access does Article 15 protect?",
      "back": "Access to shops, hotels, wells, tanks and other public places.",
      "examPoint": "Articles 12-22 clause by clause — 13(1)-(3), 15(3)-(6), 16(3)-(6), 17, 18, 19 restrictions, 20, 21 expansion, 21A, 22 preventive detention",
      "source": "APPSC GK — Indian Polity: Fundamental Rights - I (Article 12-22).txt, Fundamental Rights - II (Article 23-35).txt, Important Constitutional Cases.txt; M. Laxmikanth, Indian Polity (Ch. 7) standard treatment; PYQ bank .research/pyq-bank/pol-fundamental-rights.md",
      "verified": true
    },
    {
      "id": "pol-fundamental-rights-card-17",
      "subjectCode": "POL",
      "subtopicId": "pol-fundamental-rights",
      "front": "What does Article 16(5) allow?",
      "back": "An office connected with a religious institution may be kept for persons professing that religion.",
      "examPoint": "Articles 12-22 clause by clause — 13(1)-(3), 15(3)-(6), 16(3)-(6), 17, 18, 19 restrictions, 20, 21 expansion, 21A, 22 preventive detention",
      "source": "APPSC GK — Indian Polity: Fundamental Rights - I (Article 12-22).txt, Fundamental Rights - II (Article 23-35).txt, Important Constitutional Cases.txt; M. Laxmikanth, Indian Polity (Ch. 7) standard treatment; PYQ bank .research/pyq-bank/pol-fundamental-rights.md",
      "verified": true
    },
    {
      "id": "pol-fundamental-rights-card-18",
      "subjectCode": "POL",
      "subtopicId": "pol-fundamental-rights",
      "front": "Which 2005 law set up national and state commissions for child rights?",
      "back": "The Commissions for Protection of Child Rights Act, 2005.",
      "examPoint": "Articles 23-35 in detail — 23/24, 25-28, 29/30, 32 and writ limits, 33-35, martial law vs emergency, 31A/31B/31C, significance and criticism",
      "source": "APPSC GK — Indian Polity: Fundamental Rights - I (Article 12-22).txt, Fundamental Rights - II (Article 23-35).txt, Important Constitutional Cases.txt; M. Laxmikanth, Indian Polity (Ch. 7) standard treatment; PYQ bank .research/pyq-bank/pol-fundamental-rights.md",
      "verified": true
    }
  ]
}
