{
  "kind": "cards",
  "subjectCode": "POL",
  "topic": "Central & State Government Policies & Programmes",
  "items": [
    {
      "id": "pol-policies-programmes-card-1",
      "subjectCode": "POL",
      "subtopicId": "pol-policies-programmes",
      "front": "Central Sector vs Centrally Sponsored?",
      "back": "Central Sector = 100% Union-funded (PM-KISAN); CSS = shared Centre-State (60:40, 90:10 special), largely State-List subjects (MGNREGA, PMAY, JJM).",
      "examPoint": "Scheme classification",
      "source": "NITI Aayog",
      "verified": true
    },
    {
      "id": "pol-policies-programmes-card-2",
      "subjectCode": "POL",
      "subtopicId": "pol-policies-programmes",
      "front": "DBT & JAM?",
      "back": "DBT sends benefits straight to bank accounts; rides on JAM trinity = Jan Dhan + Aadhaar + Mobile; cuts leakage.",
      "examPoint": "DBT & JAM trinity",
      "source": "DBT Mission",
      "verified": true
    },
    {
      "id": "pol-policies-programmes-card-3",
      "subjectCode": "POL",
      "subtopicId": "pol-policies-programmes",
      "front": "PM-KISAN & Ayushman?",
      "back": "PM-KISAN = ₹6,000/yr in 3 instalments to landholding farmers. Ayushman Bharat PM-JAY = ₹5 lakh/family health cover; extended to all 70+ (2024).",
      "examPoint": "PM-KISAN & PM-JAY",
      "source": "PIB",
      "verified": true
    },
    {
      "id": "pol-policies-programmes-card-4",
      "subjectCode": "POL",
      "subtopicId": "pol-policies-programmes",
      "front": "MGNREGA & Ujjwala?",
      "back": "MGNREGA 2005 = 100 days guaranteed work + social audit (replaced from 1 July 2026 by VB-G RAM G, 125 days). PMUY = free LPG connections to poor women.",
      "examPoint": "MGNREGA & Ujjwala",
      "source": "PIB",
      "verified": true
    },
    {
      "id": "pol-policies-programmes-card-5",
      "subjectCode": "POL",
      "subtopicId": "pol-policies-programmes",
      "front": "PMFBY premium rates?",
      "back": "Farmer premium: 2% Kharif, 1.5% Rabi, 5% commercial/horticultural crops (2016; Ministry of Agriculture).",
      "examPoint": "PMFBY — premium 2% Kharif / 1.5% Rabi / 5% commercial-horticulture",
      "source": "UPSC 2018",
      "verified": true
    },
    {
      "id": "pol-policies-programmes-card-6",
      "subjectCode": "POL",
      "subtopicId": "pol-policies-programmes",
      "front": "Insurance & pension trio (2015)?",
      "back": "PMJJBY = life cover ₹2 lakh; PMSBY = accident cover ₹2 lakh; Atal Pension Yojana = guaranteed old-age pension.",
      "examPoint": "Social-security insurance trio — PMJJBY, PMSBY, Atal Pension Yojana",
      "source": "UPSC 2016",
      "verified": true
    },
    {
      "id": "pol-policies-programmes-card-7",
      "subjectCode": "POL",
      "subtopicId": "pol-policies-programmes",
      "front": "Scheme-purpose matches?",
      "back": "Mission Indradhanush = immunisation; SWAYAM = online MOOCs; DDU-GKY = rural youth skilling; PMJDY = financial inclusion (RuPay, ₹2 lakh cover).",
      "examPoint": "Scheme-purpose matching — Mission Indradhanush (immunisation), SWAYAM (MOOCs)",
      "source": "UPSC PYQ",
      "verified": true
    },
    {
      "id": "pol-policies-programmes-card-8",
      "subjectCode": "POL",
      "subtopicId": "pol-policies-programmes",
      "front": "MPLADS facts?",
      "back": "Funds create durable assets; district authority inspects a share; unused funds are carried forward (do NOT lapse); SC/ST earmark.",
      "examPoint": "MPLADS — durable assets; unused funds carried forward",
      "source": "UPSC 2021",
      "verified": true
    },
    {
      "id": "pol-policies-programmes-card-9",
      "subjectCode": "POL",
      "subtopicId": "pol-policies-programmes",
      "front": "Newer central schemes?",
      "back": "PM SVANidhi (street-vendor micro-loans); PM Vishwakarma (2023, 18 artisan trades); PM Suryaghar Muft Bijli (2024, rooftop solar, 300 free units).",
      "examPoint": "Newer schemes — SVANidhi, Vishwakarma, Suryaghar",
      "source": "PIB",
      "verified": true
    },
    {
      "id": "pol-policies-programmes-card-10",
      "subjectCode": "POL",
      "subtopicId": "pol-policies-programmes",
      "front": "AP 'Super Six' (2024 NDA)?",
      "back": "Thalliki Vandanam (schooling), Annadata Sukhibhava (₹20k farmers incl PM-KISAN), Deepam-2 (3 free LPG), free women bus travel, Adabidda Nidhi (₹1,500/mo), youth allowance (₹3,000/mo).",
      "examPoint": "AP Super Six (2024)",
      "source": "Govt of AP",
      "verified": true
    },
    {
      "id": "pol-policies-programmes-card-11",
      "subjectCode": "POL",
      "subtopicId": "pol-policies-programmes",
      "front": "YSR-era AP schemes (2019-24)?",
      "back": "'Navaratnalu': Amma Vodi (schooling), YSR Rythu Bharosa (farmers), YSR Aarogyasri (health), YSR Cheyutha (women), Jagananna Vidya Deevena (fees). Distinct from Super Six.",
      "examPoint": "YSR-era AP schemes — Amma Vodi, Rythu Bharosa, Aarogyasri, Cheyutha",
      "source": "Govt of AP",
      "verified": true
    },
    {
      "id": "pol-policies-programmes-card-12",
      "subjectCode": "POL",
      "subtopicId": "pol-policies-programmes",
      "front": "Implementation tools?",
      "back": "Outcome budgeting (results not outlays); social audit (MGNREGA); DBT+JAM; 2nd ARC citizen-centric single-window delivery (CPGRAMS); AP ward secretariats + P4 model.",
      "examPoint": "Implementation & accountability",
      "source": "2nd ARC",
      "verified": true
    }
  ]
}
