{
  "kind": "cards",
  "subjectCode": "HIST",
  "topic": "National Movement in Andhra",
  "items": [
    {
      "id": "hist-ap-andhra-freedom-movement-card-1",
      "subjectCode": "HIST",
      "subtopicId": "hist-ap-andhra-freedom-movement",
      "front": "Leader of the Rampa (Manyam) Rebellion of 1922–24?",
      "back": "Alluri Sitarama Raju, the 'Manyam Veerudu', in the Godavari/Visakhapatnam agency.",
      "examPoint": "Rampa Rebellion — Alluri",
      "source": "Wikipedia — Alluri Sitarama Raju",
      "verified": true
    },
    {
      "id": "hist-ap-andhra-freedom-movement-card-2",
      "subjectCode": "HIST",
      "subtopicId": "hist-ap-andhra-freedom-movement",
      "front": "What grievance triggered the Rampa rebellion?",
      "back": "The 1882 Madras Forest Act — curbing podu (shifting) cultivation and imposing vetti (forced labour).",
      "examPoint": "Rampa causes",
      "source": "Wikipedia — Rampa Rebellion 1922",
      "verified": true
    },
    {
      "id": "hist-ap-andhra-freedom-movement-card-3",
      "subjectCode": "HIST",
      "subtopicId": "hist-ap-andhra-freedom-movement",
      "front": "When was Alluri Sitarama Raju captured and killed?",
      "back": "7 May 1924 (shot dead after capture).",
      "examPoint": "Alluri capture-killing",
      "source": "Wikipedia — Alluri Sitarama Raju",
      "verified": true
    },
    {
      "id": "hist-ap-andhra-freedom-movement-card-4",
      "subjectCode": "HIST",
      "subtopicId": "hist-ap-andhra-freedom-movement",
      "front": "'Andhra Kesari', first CM of Andhra State, famed for Simon Commission defiance (Madras 1928)?",
      "back": "Tanguturi Prakasam Pantulu.",
      "examPoint": "Tanguturi Prakasam",
      "source": "Wikipedia — Tanguturi Prakasam",
      "verified": true
    },
    {
      "id": "hist-ap-andhra-freedom-movement-card-5",
      "subjectCode": "HIST",
      "subtopicId": "hist-ap-andhra-freedom-movement",
      "front": "'Andhra Ratna' and first Andhra AICC secretary, who led the Chirala–Perala satyagraha?",
      "back": "Duggirala Gopalakrishnayya.",
      "examPoint": "Duggirala / Chirala-Perala",
      "source": "Wikipedia — Duggirala Gopalakrishnayya",
      "verified": true
    },
    {
      "id": "hist-ap-andhra-freedom-movement-card-6",
      "subjectCode": "HIST",
      "subtopicId": "hist-ap-andhra-freedom-movement",
      "front": "The Chirala–Perala satyagraha (1921) is remembered for what?",
      "back": "A mass exodus of residents to a new settlement 'Ramnagar' to protest municipal taxes.",
      "examPoint": "Chirala–Perala satyagraha",
      "source": "Wikipedia — Duggirala Gopalakrishnayya",
      "verified": true
    },
    {
      "id": "hist-ap-andhra-freedom-movement-card-7",
      "subjectCode": "HIST",
      "subtopicId": "hist-ap-andhra-freedom-movement",
      "front": "Centre of the Guntur no-tax campaign (1921–22)?",
      "back": "Pedanandipadu — led by Parvataneni Veerayya Choudary.",
      "examPoint": "Pedanandipadu no-tax",
      "source": "Wikipedia — Andhra movement",
      "verified": true
    },
    {
      "id": "hist-ap-andhra-freedom-movement-card-8",
      "subjectCode": "HIST",
      "subtopicId": "hist-ap-andhra-freedom-movement",
      "front": "Martyr of the Palnadu forest (Pullari/grazing-tax) satyagraha, 1922?",
      "back": "Kanneganti Hanumanthu.",
      "examPoint": "Palnadu forest satyagraha",
      "source": "Wikipedia — Andhra movement",
      "verified": true
    },
    {
      "id": "hist-ap-andhra-freedom-movement-card-9",
      "subjectCode": "HIST",
      "subtopicId": "hist-ap-andhra-freedom-movement",
      "front": "Andhra Congress leader who wrote the INC's history and was defeated by Bose at Tripuri (1939)?",
      "back": "Pattabhi Sitaramayya.",
      "examPoint": "Pattabhi Sitaramayya",
      "source": "Wikipedia — Pattabhi Sitaramayya",
      "verified": true
    },
    {
      "id": "hist-ap-andhra-freedom-movement-card-10",
      "subjectCode": "HIST",
      "subtopicId": "hist-ap-andhra-freedom-movement",
      "front": "Founder of Andhra Patrika, titled 'Desoddharaka'?",
      "back": "Kasinadhuni Nageswara Rao.",
      "examPoint": "Kasinadhuni Nageswara Rao",
      "source": "Wikipedia — Kasinadhuni Nageswara Rao",
      "verified": true
    },
    {
      "id": "hist-ap-andhra-freedom-movement-card-11",
      "subjectCode": "HIST",
      "subtopicId": "hist-ap-andhra-freedom-movement",
      "front": "'Desabhakta', a father-figure of the Andhra movement?",
      "back": "Konda Venkatappayya — organiser of early Andhra provincial conferences.",
      "examPoint": "Konda Venkatappayya",
      "source": "Wikipedia — Konda Venkatappayya",
      "verified": true
    },
    {
      "id": "hist-ap-andhra-freedom-movement-card-12",
      "subjectCode": "HIST",
      "subtopicId": "hist-ap-andhra-freedom-movement",
      "front": "Nationalist poet whose songs stirred the Non-Cooperation movement in Andhra?",
      "back": "Garimella Satyanarayana (song 'Maa koddi ee tella dora tanam' — we don't want this white rule).",
      "examPoint": "Garimella Satyanarayana",
      "source": "Wikipedia — Garimella Satyanarayana",
      "verified": true
    },
    {
      "id": "hist-ap-andhra-freedom-movement-card-13",
      "subjectCode": "HIST",
      "subtopicId": "hist-ap-andhra-freedom-movement",
      "front": "Body founded Nov 1921 that became the Andhra Mahasabha (1930, Jogipet) in Hyderabad State?",
      "back": "The Andhra Jana Sangham — a Telugu-language and anti-Nizam awakening.",
      "examPoint": "Andhra Jana Sangham → Mahasabha",
      "source": "Wikipedia — Andhra Mahasabha",
      "verified": true
    },
    {
      "id": "hist-ap-andhra-freedom-movement-card-14",
      "subjectCode": "HIST",
      "subtopicId": "hist-ap-andhra-freedom-movement",
      "front": "Early Swadeshi trigger in Andhra (1905–07) and B.C. Pal's 1907 tour destination?",
      "back": "The Vandemataram movement after Bengal's partition; Bipin Chandra Pal toured Rajahmundry (1907).",
      "examPoint": "Vandemataram movement in Andhra",
      "source": "Wikipedia — Andhra movement",
      "verified": true
    }
  ]
}
