{
  "kind": "cards",
  "subjectCode": "POL",
  "topic": "Fundamental Duties",
  "items": [
    {
      "id": "pol-fundamental-duties-card-1",
      "subjectCode": "POL",
      "subtopicId": "pol-fundamental-duties",
      "front": "Fundamental Duties — Part, Article, and how added?",
      "back": "Part IV-A, single Article 51A; added by the 42nd Amendment (1976). Not in the original 1950 Constitution.",
      "examPoint": "42nd Amendment Act 1976 added Fundamental Duties (originally 10)",
      "source": "42nd Amendment 1976; Art 51A",
      "verified": true
    },
    {
      "id": "pol-fundamental-duties-card-2",
      "subjectCode": "POL",
      "subtopicId": "pol-fundamental-duties",
      "front": "On whose recommendation were Fundamental Duties added, and inspired by which country?",
      "back": "Swaran Singh Committee (1976); inspired by the Constitution of the erstwhile USSR.",
      "examPoint": "Swaran Singh Committee (1976) recommendation",
      "source": "Swaran Singh Committee 1976",
      "verified": true
    },
    {
      "id": "pol-fundamental-duties-card-3",
      "subjectCode": "POL",
      "subtopicId": "pol-fundamental-duties",
      "front": "How many duties originally, and how many now?",
      "back": "Originally 10; the 86th Amendment (2002) added the 11th (parent/guardian to provide education, ages 6-14).",
      "examPoint": "86th Amendment Act 2002 added the 11th duty (education, ages 6-14)",
      "source": "86th Amendment 2002; Art 51A(k)",
      "verified": true
    },
    {
      "id": "pol-fundamental-duties-card-4",
      "subjectCode": "POL",
      "subtopicId": "pol-fundamental-duties",
      "front": "Are Fundamental Duties enforceable by a court?",
      "back": "No — they are non-justiciable; but Parliament may prescribe penalties by law, and courts use them to interpret statutes.",
      "examPoint": "Non-justiciable — not legally enforceable",
      "source": "UPSC 2017 PYQ; Art 51A",
      "verified": true
    },
    {
      "id": "pol-fundamental-duties-card-5",
      "subjectCode": "POL",
      "subtopicId": "pol-fundamental-duties",
      "front": "To whom do Fundamental Duties apply?",
      "back": "Only to citizens of India — not to foreigners or the State.",
      "examPoint": "Applicable to citizens only (not to all persons/foreigners)",
      "source": "Art 51A",
      "verified": true
    },
    {
      "id": "pol-fundamental-duties-card-6",
      "subjectCode": "POL",
      "subtopicId": "pol-fundamental-duties",
      "front": "'To uphold and protect the sovereignty, unity and integrity of India' is which provision?",
      "back": "A Fundamental Duty — Article 51A(c).",
      "examPoint": "Duties (b)-(d) — freedom-struggle ideals, sovereignty/unity/integrity, defence & national service",
      "source": "UPSC 2015 PYQ; Art 51A(c)",
      "verified": true
    },
    {
      "id": "pol-fundamental-duties-card-7",
      "subjectCode": "POL",
      "subtopicId": "pol-fundamental-duties",
      "front": "In India, what is the relationship between rights and duties?",
      "back": "Rights are correlative with duties — the two go together.",
      "examPoint": "Significance — balancing rights with responsibilities & civic sense",
      "source": "UPSC 2017 PYQ",
      "verified": true
    },
    {
      "id": "pol-fundamental-duties-card-8",
      "subjectCode": "POL",
      "subtopicId": "pol-fundamental-duties",
      "front": "Which single duty mentions the dignity of women?",
      "back": "51A(e) — promote harmony and renounce practices derogatory to the dignity of women.",
      "examPoint": "Duty 51A(e) — common brotherhood & renouncing practices derogatory to women",
      "source": "Art 51A(e)",
      "verified": true
    },
    {
      "id": "pol-fundamental-duties-card-9",
      "subjectCode": "POL",
      "subtopicId": "pol-fundamental-duties",
      "front": "Which duty covers scientific temper, and which covers the environment?",
      "back": "51A(h) = scientific temper, humanism, spirit of inquiry; 51A(g) = protect the natural environment.",
      "examPoint": "Duties (h)-(j) — scientific temper, safeguard public property/abjure violence, strive for excellence",
      "source": "Art 51A(g), (h)",
      "verified": true
    },
    {
      "id": "pol-fundamental-duties-card-10",
      "subjectCode": "POL",
      "subtopicId": "pol-fundamental-duties",
      "front": "Which committee (1999) reviewed operationalising Fundamental Duties?",
      "back": "The Justice J.S. Verma Committee (1999).",
      "examPoint": "Verma Committee (1999) on operationalisation of duties",
      "source": "Verma Committee 1999",
      "verified": true
    },
    {
      "id": "pol-fundamental-duties-card-11",
      "subjectCode": "POL",
      "subtopicId": "pol-fundamental-duties",
      "front": "Besides FRs, which parts reflect the UDHR 1948?",
      "back": "Preamble, DPSP and Fundamental Duties.",
      "examPoint": "Complementary to DPSP (Part IV) & Fundamental Rights (Part III)",
      "source": "UPSC 2020 PYQ; UDHR 1948",
      "verified": true
    },
    {
      "id": "pol-fundamental-duties-card-12",
      "subjectCode": "POL",
      "subtopicId": "pol-fundamental-duties",
      "front": "Which case linked the National Anthem to duty 51A(a)?",
      "back": "Shyam Narayan Chouksey v. Union of India (2016) — anthem in cinemas; order relaxed/modified in 2018.",
      "examPoint": "Shyam Narayan Chouksey v. Union of India — National Anthem case (2016/2018)",
      "source": "Shyam Narayan Chouksey (2016/2018)",
      "verified": true
    },
    {
      "id": "pol-fundamental-duties-card-13",
      "subjectCode": "POL",
      "subtopicId": "pol-fundamental-duties",
      "front": "Which amendment is called a \"mini-Constitution\" and added the Fundamental Duties?",
      "back": "The 42nd Amendment Act, 1976.",
      "examPoint": "Swaran Singh Committee details (8 recommended, 10 adopted, rejected suggestions), exact wording of each duty, features",
      "source": "APPSC GK — Indian Polity: Fundamental Duties Article (51A).txt; M. Laxmikanth, Indian Polity (Ch. 9) standard treatment; PYQ bank .research/pyq-bank/pol-fundamental-duties.md",
      "verified": true
    },
    {
      "id": "pol-fundamental-duties-card-14",
      "subjectCode": "POL",
      "subtopicId": "pol-fundamental-duties",
      "front": "Which general criminal law punishes imputations prejudicial to national integration, as noted by the Verma Committee?",
      "back": "The Indian Penal Code (now the Bharatiya Nyaya Sanhita).",
      "examPoint": "Verma Committee laws enforcing duties, significance and criticism in detail, rights-duties correlation PYQs",
      "source": "APPSC GK — Indian Polity: Fundamental Duties Article (51A).txt; M. Laxmikanth, Indian Polity (Ch. 9) standard treatment; PYQ bank .research/pyq-bank/pol-fundamental-duties.md",
      "verified": true
    },
    {
      "id": "pol-fundamental-duties-card-15",
      "subjectCode": "POL",
      "subtopicId": "pol-fundamental-duties",
      "front": "Name one way the Fundamental Duties promote discipline among citizens.",
      "back": "They are a source of inspiration that promotes a sense of discipline and commitment.",
      "examPoint": "Verma Committee laws enforcing duties, significance and criticism in detail, rights-duties correlation PYQs",
      "source": "APPSC GK — Indian Polity: Fundamental Duties Article (51A).txt; M. Laxmikanth, Indian Polity (Ch. 9) standard treatment; PYQ bank .research/pyq-bank/pol-fundamental-duties.md",
      "verified": true
    }
  ]
}
