{
  "kind": "cards",
  "subjectCode": "POL",
  "topic": "Rights Issues & Vulnerable Sections",
  "items": [
    {
      "id": "pol-rights-issues-card-1",
      "subjectCode": "POL",
      "subtopicId": "pol-rights-issues",
      "front": "UDHR — date & binding covenants?",
      "back": "Adopted 10 Dec 1948 (Human Rights Day); non-binding. Binding covenants ICCPR & ICESCR (1966), India ratified 1979.",
      "examPoint": "UDHR (1948) reflected in Preamble, DPSP & Fundamental Duties",
      "source": "UN",
      "verified": true
    },
    {
      "id": "pol-rights-issues-card-2",
      "subjectCode": "POL",
      "subtopicId": "pol-rights-issues",
      "front": "NHRC — statute, 2019 change, armed-forces?",
      "back": "Protection of Human Rights Act 1993; statutory & recommendatory; 2019 amd: SC judge (not only ex-CJI) can chair, term 5→3 yrs; limited role over armed forces.",
      "examPoint": "NHRC framework (PHRA 1993 & 2019)",
      "source": "PHRA 1993/2019",
      "verified": true
    },
    {
      "id": "pol-rights-issues-card-3",
      "subjectCode": "POL",
      "subtopicId": "pol-rights-issues",
      "front": "Art 17 & untouchability laws?",
      "back": "Art 17 abolishes untouchability (Right to Equality); enforced by Protection of Civil Rights Act 1955 & SC/ST (PoA) Act 1989.",
      "examPoint": "Untouchability — Art 17 & PoA Act 1989",
      "source": "Constitution",
      "verified": true
    },
    {
      "id": "pol-rights-issues-card-4",
      "subjectCode": "POL",
      "subtopicId": "pol-rights-issues",
      "front": "Right to Privacy & life — Article?",
      "back": "Art 21; privacy affirmed in Puttaswamy (2017, 9-judge); also right to marry of choice, dignity, clean environment.",
      "examPoint": "Art 21 — life, privacy, choice",
      "source": "Puttaswamy 2017",
      "verified": true
    },
    {
      "id": "pol-rights-issues-card-5",
      "subjectCode": "POL",
      "subtopicId": "pol-rights-issues",
      "front": "Right to Property today?",
      "back": "44th Amendment 1978 removed it as a FR; now a legal/constitutional right under Art 300A, available to any person.",
      "examPoint": "Right to Property — Art 300A (44th Amendment 1978), a legal right",
      "source": "Constitution Art 300A",
      "verified": true
    },
    {
      "id": "pol-rights-issues-card-6",
      "subjectCode": "POL",
      "subtopicId": "pol-rights-issues",
      "front": "Fifth vs Sixth Schedule?",
      "back": "Fifth = Scheduled Areas/STs in 10 States; restricts tribal-land transfer to non-tribals; Governor + Tribes Advisory Council. Sixth = autonomous councils in Assam, Meghalaya, Tripura, Mizoram.",
      "examPoint": "Fifth Schedule — restricts transfer of tribal land to non-tribals",
      "source": "Constitution",
      "verified": true
    },
    {
      "id": "pol-rights-issues-card-7",
      "subjectCode": "POL",
      "subtopicId": "pol-rights-issues",
      "front": "RTE — Article & Act?",
      "back": "Art 21A (86th Amendment 2002) — free education ages 6-14; RTE Act 2009 (force 1 Apr 2010); 25% EWS seats in private unaided schools.",
      "examPoint": "RTE — Art 21A & RTE Act 2009",
      "source": "RTE Act 2009",
      "verified": true
    },
    {
      "id": "pol-rights-issues-card-8",
      "subjectCode": "POL",
      "subtopicId": "pol-rights-issues",
      "front": "Women's laws — POSH & Nirbhaya?",
      "back": "POSH Act 2013 codified Vishaka (1997), ICC in 10+ workplaces; Criminal Law (Amdt) Act 2013 (Nirbhaya, Justice Verma); Maternity leave 12→26 weeks (2017).",
      "examPoint": "Women's rights — POSH, Nirbhaya, NCW",
      "source": "statutes",
      "verified": true
    },
    {
      "id": "pol-rights-issues-card-9",
      "subjectCode": "POL",
      "subtopicId": "pol-rights-issues",
      "front": "Child laws — POCSO & JJ?",
      "back": "POCSO 2012 (gender-neutral, under-18); JJ Act 2015 (16-18 tried as adults for heinous); NCPCR under CPCR Act 2005; Child Labour Amdt 2016 (no work below 14).",
      "examPoint": "Child rights — POCSO, JJ Act, NCPCR",
      "source": "statutes",
      "verified": true
    },
    {
      "id": "pol-rights-issues-card-10",
      "subjectCode": "POL",
      "subtopicId": "pol-rights-issues",
      "front": "RPwD Act 2016?",
      "back": "Replaced 1995 Act; disabilities 7→21; 4% job & 5% higher-education reservation; implements UNCRPD (ratified 2007).",
      "examPoint": "RPwD Act 2016 & CRPD",
      "source": "RPwD Act 2016",
      "verified": true
    },
    {
      "id": "pol-rights-issues-card-11",
      "subjectCode": "POL",
      "subtopicId": "pol-rights-issues",
      "front": "SC/ST commissions & PoA 2018?",
      "back": "NCSC (338), NCST (338A) split by 89th Amdt 2003; NCBC (338B) 102nd Amdt 2018. PoA 2018 amendment (Sec 18A) restored bar on anticipatory bail after Subhash Kashinath Mahajan.",
      "examPoint": "SC/ST commissions & PoA Act",
      "source": "Constitution; PoA 2018",
      "verified": true
    },
    {
      "id": "pol-rights-issues-card-12",
      "subjectCode": "POL",
      "subtopicId": "pol-rights-issues",
      "front": "Sub-classification of SCs (2024)?",
      "back": "A 7-judge Supreme Court bench held States CAN sub-classify SCs for reservation, overruling E.V. Chinnaiah (2004).",
      "examPoint": "Sub-classification of SCs — Supreme Court 2024 (7-judge)",
      "source": "SC 2024",
      "verified": true
    }
  ]
}
