{
  "kind": "cards",
  "subjectCode": "ECON",
  "topic": "Industry & Industrial Policy",
  "items": [
    {
      "id": "econ-industry-card-1",
      "subjectCode": "ECON",
      "subtopicId": "econ-industry",
      "front": "Which IPR is called the 'economic constitution of India'?",
      "back": "IPR 1956 — created Schedule A (17 state-exclusive industries), tied to the Second Plan.",
      "examPoint": "IPR 1956 — economic constitution",
      "source": "notes",
      "verified": true
    },
    {
      "id": "econ-industry-card-2",
      "subjectCode": "ECON",
      "subtopicId": "econ-industry",
      "front": "What did the New Industrial Policy 1991 do?",
      "back": "Abolished most licensing; cut reserved industries 17→8 (today only 2: atomic energy, railways).",
      "examPoint": "NIP 1991 — liberalisation, de-reservation",
      "source": "notes",
      "verified": true
    },
    {
      "id": "econ-industry-card-3",
      "subjectCode": "ECON",
      "subtopicId": "econ-industry",
      "front": "Which Act replaced the MRTP Act, and its regulator?",
      "back": "Competition Act, 2002; CCI operational 2009.",
      "examPoint": "Competition Act 2002 replaced MRTP",
      "source": "notes",
      "verified": true
    },
    {
      "id": "econ-industry-card-4",
      "subjectCode": "ECON",
      "subtopicId": "econ-industry",
      "front": "Three types of Public Sector Enterprises with examples?",
      "back": "Departmental (Railways), statutory corporation (LIC), government company (SAIL, ≥51% govt).",
      "examPoint": "PSE types",
      "source": "notes",
      "verified": true
    },
    {
      "id": "econ-industry-card-5",
      "subjectCode": "ECON",
      "subtopicId": "econ-industry",
      "front": "Maharatna criteria (net worth / turnover / profit)?",
      "back": "Prior Navratna; net worth ≥₹15,000cr, turnover ≥₹25,000cr, net profit ≥₹5,000cr.",
      "examPoint": "Maharatna criteria (2010)",
      "source": "notes",
      "verified": true
    },
    {
      "id": "econ-industry-card-6",
      "subjectCode": "ECON",
      "subtopicId": "econ-industry",
      "front": "Count of Maharatna/Navratna/Miniratna (2025)?",
      "back": "14 Maharatnas, 26 Navratnas, 65 Miniratnas.",
      "examPoint": "Ratna counts 2025",
      "source": "notes",
      "verified": true
    },
    {
      "id": "econ-industry-card-7",
      "subjectCode": "ECON",
      "subtopicId": "econ-industry",
      "front": "MSME thresholds from 1 Apr 2025 (investment/turnover)?",
      "back": "Micro ≤₹2.5cr/₹10cr, Small ≤₹25cr/₹100cr, Medium ≤₹125cr/₹500cr.",
      "examPoint": "MSME thresholds (1 Apr 2025)",
      "source": "notes",
      "verified": true
    },
    {
      "id": "econ-industry-card-8",
      "subjectCode": "ECON",
      "subtopicId": "econ-industry",
      "front": "IBC 2016 — what it replaced and who adjudicates companies?",
      "back": "Replaced SICA/BIFR; time-bound resolution; NCLT adjudicates company cases.",
      "examPoint": "IBC 2016 — NCLT, replaced SICA/BIFR",
      "source": "notes",
      "verified": true
    },
    {
      "id": "econ-industry-card-9",
      "subjectCode": "ECON",
      "subtopicId": "econ-industry",
      "front": "Make in India — launch, sectors, target?",
      "back": "25 Sep 2014; 25 sectors; 'Zero Defect Zero Effect'; ~25% manufacturing GDP share.",
      "examPoint": "Make in India 2014",
      "source": "notes",
      "verified": true
    },
    {
      "id": "econ-industry-card-10",
      "subjectCode": "ECON",
      "subtopicId": "econ-industry",
      "front": "PLI scheme — year, sectors, outlay?",
      "back": "2020; 14 sectors; ~₹1.97 lakh crore; rewards incremental domestic sales.",
      "examPoint": "PLI — 14 sectors, ₹1.97 lakh cr",
      "source": "notes",
      "verified": true
    },
    {
      "id": "econ-industry-card-11",
      "subjectCode": "ECON",
      "subtopicId": "econ-industry",
      "front": "Eight Core Industries — IIP weight and members?",
      "back": "~40.27% of IIP: coal, crude oil, natural gas, refinery, fertilizers, steel, cement, electricity.",
      "examPoint": "Eight Core Industries (IIP 40.27%)",
      "source": "notes",
      "verified": true
    },
    {
      "id": "econ-industry-card-12",
      "subjectCode": "ECON",
      "subtopicId": "econ-industry",
      "front": "Four labour codes — count consolidated and in-force date?",
      "back": "Consolidate 29 central laws; came into force 21 Nov 2025; cover gig/platform workers.",
      "examPoint": "Four labour codes — in force 21 Nov 2025",
      "source": "Wikipedia — Indian labour law (verified 30 Sep 2026)",
      "verified": true
    },
    {
      "id": "econ-industry-card-13",
      "subjectCode": "ECON",
      "subtopicId": "econ-industry",
      "front": "VCIC and AP industrial nodes?",
      "back": "VCIC = first phase of East Coast Economic Corridor (ADB-led); nodes Sri City, Kopparthi, Orvakal.",
      "examPoint": "AP angle — VCIC & investment nodes",
      "source": "notes",
      "verified": true
    },
    {
      "id": "econ-industry-card-14",
      "subjectCode": "ECON",
      "subtopicId": "econ-industry",
      "front": "Features of small-scale industries (source)?",
      "back": "Low capital, few workers, labour-intensive, low mechanisation (e.g. handicrafts, food processing).",
      "examPoint": "Industrial Policy Resolutions 1948 & 1956",
      "source": "APPSC GK — Indian Economics: Indian Industries.txt, Public Sector Enterprises.txt; DPE/PIB (Ratna status 2024-26, RINL revival 2025, smart cities 2024, ECMS/ISM Budget 2026-27, PLI disbursals); MoSPI/OEA (IIP and ICI base 2022-23, 2026); Ministry of Labour (codes, 21 Nov 2025); AP Industrial Development Policy 4.0; AP dossier-econ; PYQ bank .research/pyq-bank/econ-industry.md (verified Oct 2026)",
      "verified": true
    },
    {
      "id": "econ-industry-card-15",
      "subjectCode": "ECON",
      "subtopicId": "econ-industry",
      "front": "Headquarters of NMDC and NALCO (both Navratnas)?",
      "back": "NMDC — Hyderabad; NALCO — Bhubaneswar.",
      "examPoint": "Industrial Policy Resolutions 1948 & 1956",
      "source": "APPSC GK — Indian Economics: Indian Industries.txt, Public Sector Enterprises.txt; DPE/PIB (Ratna status 2024-26, RINL revival 2025, smart cities 2024, ECMS/ISM Budget 2026-27, PLI disbursals); MoSPI/OEA (IIP and ICI base 2022-23, 2026); Ministry of Labour (codes, 21 Nov 2025); AP Industrial Development Policy 4.0; AP dossier-econ; PYQ bank .research/pyq-bank/econ-industry.md (verified Oct 2026)",
      "verified": true
    },
    {
      "id": "econ-industry-card-16",
      "subjectCode": "ECON",
      "subtopicId": "econ-industry",
      "front": "When was pre-packaged insolvency for MSMEs added to the IBC?",
      "back": "2021 — a faster, debtor-initiated resolution route for MSMEs.",
      "examPoint": "Industrial Policy Resolutions 1948 & 1956",
      "source": "APPSC GK — Indian Economics: Indian Industries.txt, Public Sector Enterprises.txt; DPE/PIB (Ratna status 2024-26, RINL revival 2025, smart cities 2024, ECMS/ISM Budget 2026-27, PLI disbursals); MoSPI/OEA (IIP and ICI base 2022-23, 2026); Ministry of Labour (codes, 21 Nov 2025); AP Industrial Development Policy 4.0; AP dossier-econ; PYQ bank .research/pyq-bank/econ-industry.md (verified Oct 2026)",
      "verified": true
    },
    {
      "id": "econ-industry-card-17",
      "subjectCode": "ECON",
      "subtopicId": "econ-industry",
      "front": "First IIP base year, and which revision is the 2022-23 series?",
      "back": "First base 1937; the 2022-23 series is the 10th revision (previous 2011-12).",
      "examPoint": "Industrial Policy Resolutions 1948 & 1956",
      "source": "APPSC GK — Indian Economics: Indian Industries.txt, Public Sector Enterprises.txt; DPE/PIB (Ratna status 2024-26, RINL revival 2025, smart cities 2024, ECMS/ISM Budget 2026-27, PLI disbursals); MoSPI/OEA (IIP and ICI base 2022-23, 2026); Ministry of Labour (codes, 21 Nov 2025); AP Industrial Development Policy 4.0; AP dossier-econ; PYQ bank .research/pyq-bank/econ-industry.md (verified Oct 2026)",
      "verified": true
    },
    {
      "id": "econ-industry-card-18",
      "subjectCode": "ECON",
      "subtopicId": "econ-industry",
      "front": "Weight of iron ore in the new (2022-23) Index of Core Industries?",
      "back": "About 4.9% of the nine-industry index.",
      "examPoint": "Industrial Policy Resolutions 1948 & 1956",
      "source": "APPSC GK — Indian Economics: Indian Industries.txt, Public Sector Enterprises.txt; DPE/PIB (Ratna status 2024-26, RINL revival 2025, smart cities 2024, ECMS/ISM Budget 2026-27, PLI disbursals); MoSPI/OEA (IIP and ICI base 2022-23, 2026); Ministry of Labour (codes, 21 Nov 2025); AP Industrial Development Policy 4.0; AP dossier-econ; PYQ bank .research/pyq-bank/econ-industry.md (verified Oct 2026)",
      "verified": true
    }
  ]
}
